{
  "$schema": "https://json-schema.org/draft/2020-12/schema",
  "$id": "https://train-libre.org/schemas/food-curation.schema.json",
  "title": "Train Libre food curation overlay",
  "type": "object",
  "additionalProperties": false,
  "required": ["bls_code", "display_names", "aliases", "category_id"],
  "properties": {
    "bls_code": {"type": "string", "pattern": "^[A-Z][A-Z0-9]{6}$"},
    "display_names": {
      "type": "object",
      "additionalProperties": false,
      "properties": {
        "fr": {"$ref": "#/$defs/translation"},
        "it": {"$ref": "#/$defs/translation"},
        "ja": {"$ref": "#/$defs/translation"},
        "es": {"$ref": "#/$defs/translation"},
        "nl": {"$ref": "#/$defs/translation"}
      }
    },
    "aliases": {
      "type": "array",
      "items": {
        "type": "object",
        "additionalProperties": false,
        "required": ["language_code", "value", "kind", "method", "match_scope", "review_status"],
        "properties": {
          "language_code": {"enum": ["de", "en", "fr", "it", "ja", "es", "nl"]},
          "value": {"type": "string", "minLength": 1},
          "kind": {"enum": ["synonym", "spelling", "transliteration", "regional"]},
          "method": {"enum": ["source", "human", "machine", "machine-reviewed"]},
          "match_scope": {"enum": ["identity", "candidate_only"]},
          "review_status": {"enum": ["approved", "candidate_only"]}
        },
        "allOf": [
          {
            "if": {"properties": {"review_status": {"const": "approved"}}},
            "then": {"properties": {"method": {"enum": ["source", "human", "machine-reviewed"]}}}
          }
        ]
      }
    },
    "category_id": {"type": ["string", "null"]},
    "default_portion": {
      "type": "object", "additionalProperties": false,
      "required": ["grams", "labels", "provenance"],
      "properties": {
        "grams": {"type": "number", "exclusiveMinimum": 0},
        "labels": {"type": "object", "additionalProperties": false, "required": ["de", "en", "fr", "it", "ja", "es", "nl"], "properties": {"de": {"type": "string", "minLength": 1}, "en": {"type": "string", "minLength": 1}, "fr": {"type": "string", "minLength": 1}, "it": {"type": "string", "minLength": 1}, "ja": {"type": "string", "minLength": 1}, "es": {"type": "string", "minLength": 1}, "nl": {"type": "string", "minLength": 1}}},
        "provenance": {"type": "object", "additionalProperties": false, "required": ["kind", "method", "note"], "properties": {"kind": {"enum": ["source-backed", "train-libre-estimate"]}, "method": {"enum": ["reference", "editorial-estimate"]}, "note": {"type": "string", "minLength": 1}}}
      }
    }
  },
  "$defs": {
    "translation": {
      "type": "object",
      "additionalProperties": false,
      "required": ["value", "method"],
      "properties": {
        "value": {"type": "string", "minLength": 1},
        "method": {"enum": ["human", "machine", "machine-reviewed"]},
        "model": {"type": "string"},
        "reviewed_by": {"type": "string"},
        "reviewed_at": {"type": "string", "format": "date"},
        "note": {"type": "string"}
      }
    }
  }
}
