{
  "bls_code": "K213000",
  "display_names": {
    "fr": {
      "value": "Purée de pommes de terre en flocons instantanée",
      "method": "machine"
    },
    "it": {
      "value": "Purè di patate istantaneo in polvere",
      "method": "machine"
    },
    "ja": {
      "value": "インスタントマッシュポテト（粉末）",
      "method": "machine"
    },
    "es": {
      "value": "Puré de patata instantáneo en polvo",
      "method": "human"
    },
    "nl": {
      "value": "Instant aardappelpureepoeder",
      "method": "human"
    }
  },
  "aliases": [],
  "category_id": "potatoes_starches"
}
