{
  "bls_code": "Y650732",
  "display_names": {
    "fr": {
      "value": "Carpe marinée et grillée",
      "method": "machine"
    },
    "it": {
      "value": "Carpa marinata alla griglia",
      "method": "machine"
    },
    "ja": {
      "value": "マリネして焼いたコイ",
      "method": "machine"
    },
    "es": {
      "value": "Carpa marinada y a la parrilla",
      "method": "human"
    },
    "nl": {
      "value": "Karper gemarineerd en gegrild",
      "method": "human"
    }
  },
  "aliases": [],
  "category_id": "fish_seafood"
}
