{
  "bls_code": "S131100",
  "display_names": {
    "fr": {
      "value": "Préparation à tartiner aux fruits",
      "method": "machine"
    },
    "it": {
      "value": "Crema spalmabile alla frutta",
      "method": "machine"
    },
    "ja": {
      "value": "フルーツスプレッド",
      "method": "machine"
    },
    "es": {
      "value": "Crema untable de fruta",
      "method": "human"
    },
    "nl": {
      "value": "Vruchtenspread",
      "method": "human"
    }
  },
  "aliases": [],
  "category_id": "snacks_sweets"
}
