{
  "bls_code": "Y036223",
  "display_names": {
    "fr": {
      "value": "Pain de viande avec sauce brune de base",
      "method": "machine"
    },
    "it": {
      "value": "Polpettone con salsa bruna di base",
      "method": "machine"
    },
    "ja": {
      "value": "ミートローフのブラウンソース添え",
      "method": "machine"
    },
    "es": {
      "value": "pastel de carne picada con salsa oscura básica",
      "method": "human"
    },
    "nl": {
      "value": "gehaktbrood met bruine basissaus",
      "method": "human"
    }
  },
  "aliases": [],
  "category_id": "prepared_dishes"
}
