{
  "bls_code": "M810400",
  "display_names": {
    "fr": {
      "value": "Préparation de fromage fondu, au moins 30 % de matière grasse sur extrait sec",
      "method": "machine"
    },
    "it": {
      "value": "Preparazione di formaggio fuso, almeno 30% di materia grassa sul secco",
      "method": "machine"
    },
    "ja": {
      "value": "プロセスチーズ調製品、乾物中脂肪分30%以上",
      "method": "machine"
    },
    "es": {
      "value": "Preparado de queso fundido, mín. 30 % de grasa en materia seca",
      "method": "machine-reviewed"
    },
    "nl": {
      "value": "Bereiding van smeltkaas, min. 30 % vet in droge stof",
      "method": "machine-reviewed"
    }
  },
  "aliases": [],
  "category_id": "dairy"
}
