{
  "bls_code": "R148600",
  "display_names": {
    "fr": {
      "value": "Sauce fine / sauce barbecue à base de mayonnaise",
      "method": "machine"
    },
    "it": {
      "value": "Salsa gastronomica / salsa barbecue a base di maionese",
      "method": "machine"
    },
    "ja": {
      "value": "マヨネーズベースの調味ソース／バーベキューソース",
      "method": "machine"
    },
    "es": {
      "value": "Salsa gourmet/de barbacoa a base de mayonesa",
      "method": "human"
    },
    "nl": {
      "value": "Delicatessen-/barbecuesaus op mayonaisebasis",
      "method": "human"
    }
  },
  "aliases": [],
  "category_id": "sauces_condiments"
}
