{
  "bls_code": "X372012",
  "display_names": {
    "fr": {
      "value": "Pesto verde",
      "method": "machine"
    },
    "it": {
      "value": "Pesto verde",
      "method": "machine"
    },
    "ja": {
      "value": "ペスト・ヴェルデ",
      "method": "machine"
    },
    "es": {
      "value": "Pesto verde",
      "method": "human"
    },
    "nl": {
      "value": "Pesto verde",
      "method": "human"
    }
  },
  "aliases": [],
  "category_id": "sauces_condiments"
}
