{
  "bls_code": "W511000",
  "display_names": {
    "fr": {
      "value": "Kasseler Kamm, échine de porc salée et fumée",
      "method": "machine"
    },
    "it": {
      "value": "Kasseler Kamm, coppa di maiale salata e affumicata",
      "method": "machine"
    },
    "ja": {
      "value": "カッセラー・カム（豚肩ロースの塩漬け・燻製）",
      "method": "machine"
    },
    "es": {
      "value": "Kasseler de cuello de cerdo, ahumado curado y cocido",
      "method": "human"
    },
    "nl": {
      "value": "Kasseler-varkensnek, gerookt",
      "method": "human"
    }
  },
  "aliases": [],
  "category_id": "meat_poultry"
}
