{
  "bls_code": "P195000",
  "display_names": {
    "fr": {
      "value": "Bière mélangée à du vin mousseux",
      "method": "machine"
    },
    "it": {
      "value": "Birra con vino spumante",
      "method": "machine"
    },
    "ja": {
      "value": "スパークリングワイン入りビール",
      "method": "machine"
    },
    "es": {
      "value": "Cerveza con vino espumoso",
      "method": "machine-reviewed"
    },
    "nl": {
      "value": "Bier met mousserende wijn",
      "method": "machine-reviewed"
    }
  },
  "aliases": [],
  "category_id": "alcoholic_beverages"
}
