{
  "bls_code": "X810413",
  "display_names": {
    "fr": {
      "value": "Riz au lait sucré avec lait à 3,5 % de matières grasses et raisins secs, préparé et cuit au four",
      "method": "machine"
    },
    "it": {
      "value": "Riso al latte dolce con latte al 3,5% di grassi e uvetta, preparato e cotto al forno",
      "method": "machine"
    },
    "ja": {
      "value": "3.5%脂肪乳の甘いライスプディング、レーズン入り、成形して焼いたもの",
      "method": "machine"
    },
    "es": {
      "value": "Arroz con leche azucarado (3,5 % de grasa) con pasas, horneado",
      "method": "human"
    },
    "nl": {
      "value": "Gezoete rijstpap met melk (3,5% vet) en rozijnen, gebakken",
      "method": "human"
    }
  },
  "aliases": [],
  "category_id": "grains_cereals"
}
