{
  "bls_code": "X813113",
  "display_names": {
    "fr": {
      "value": "Riz impérial (riz au lait sucré avec crème et griottes)",
      "method": "machine"
    },
    "it": {
      "value": "Riso imperiale (riso al latte dolce con panna e amarene)",
      "method": "machine"
    },
    "ja": {
      "value": "カイザーライス（クリームとサワーチェリー入りの甘いライスプディング）",
      "method": "machine"
    },
    "es": {
      "value": "Kaiserreis (arroz con leche azucarado, con nata y cerezas ácidas)",
      "method": "human"
    },
    "nl": {
      "value": "Kaiserreis (gezoete rijstpap met room en zure kersen)",
      "method": "human"
    }
  },
  "aliases": [],
  "category_id": "grains_cereals"
}
