{
  "bls_code": "D7A7300",
  "display_names": {
    "fr": {
      "value": "Pâte danoise au pavot",
      "method": "machine"
    },
    "it": {
      "value": "Pasta danese al papavero",
      "method": "machine"
    },
    "ja": {
      "value": "ケシの実入りデニッシュ",
      "method": "machine"
    },
    "es": {
      "value": "Hojaldre danés de semillas de amapola",
      "method": "human"
    },
    "nl": {
      "value": "Maanzaadplunder",
      "method": "human"
    }
  },
  "aliases": [],
  "category_id": "bread_baked_goods"
}
