{
  "bls_code": "F3A3700",
  "display_names": {
    "fr": {
      "value": "Nectar de cassis avec édulcorants",
      "method": "machine"
    },
    "it": {
      "value": "Nettare di ribes nero con edulcoranti",
      "method": "machine"
    },
    "ja": {
      "value": "甘味料入りクロスグリネクター",
      "method": "machine"
    },
    "es": {
      "value": "néctar de grosella negra, con edulcorantes",
      "method": "human"
    },
    "nl": {
      "value": "nectar van zwarte bessen, met zoetstoffen",
      "method": "human"
    }
  },
  "aliases": [],
  "category_id": "beverages"
}
