{
  "bls_code": "S241400",
  "display_names": {
    "fr": {
      "value": "Glace mixte aux fruits, au café et aux noix, avec liqueur aux œufs",
      "method": "machine"
    },
    "it": {
      "value": "Gelato misto alla frutta, al caffè e alla frutta a guscio, con liquore all'uovo",
      "method": "machine"
    },
    "ja": {
      "value": "フルーツ・コーヒー・ナッツのミックスアイスクリーム（卵リキュール入り）",
      "method": "machine"
    },
    "es": {
      "value": "Helado mixto de fruta, café y frutos secos, con licor de huevo",
      "method": "human"
    },
    "nl": {
      "value": "Gemengd ijs (fruit, koffie, noten) met advocaat",
      "method": "human"
    }
  },
  "aliases": [],
  "category_id": "snacks_sweets"
}
