{
  "bls_code": "X496363",
  "display_names": {
    "fr": {
      "value": "Soupe froide à l’orange",
      "method": "machine"
    },
    "it": {
      "value": "Zuppa fredda all’arancia",
      "method": "machine"
    },
    "ja": {
      "value": "冷製オレンジスープ",
      "method": "machine"
    },
    "es": {
      "value": "Sopa fría de naranja",
      "method": "human"
    },
    "nl": {
      "value": "Koude sinaasappelsoep",
      "method": "human"
    }
  },
  "aliases": [],
  "category_id": "soups_stews"
}
