{
  "bls_code": "D614000",
  "display_names": {
    "fr": {
      "value": "Biscuits au muesli sans gluten",
      "method": "machine"
    },
    "it": {
      "value": "Biscotti al muesli senza glutine",
      "method": "machine"
    },
    "ja": {
      "value": "グルテンフリーミューズリービスケット",
      "method": "machine"
    },
    "es": {
      "value": "Galletas de muesli sin gluten",
      "method": "human"
    },
    "nl": {
      "value": "Mueslikoekjes, glutenvrij",
      "method": "human"
    }
  },
  "aliases": [],
  "category_id": "snacks_sweets"
}
