{
  "bls_code": "X712343",
  "display_names": {
    "fr": {
      "value": "Pâtes fraîches aux œufs avec potiron rôti, dans une sauce blanche de base à la crème",
      "method": "machine"
    },
    "it": {
      "value": "Pasta fresca all’uovo con zucca al forno, in salsa bianca di base con panna",
      "method": "machine"
    },
    "ja": {
      "value": "卵生パスタ、ローストカボチャ入り、クリーム入りホワイトソース",
      "method": "machine"
    },
    "es": {
      "value": "Pasta fresca al huevo con calabaza al horno, en salsa blanca con nata",
      "method": "human"
    },
    "nl": {
      "value": "Verse eierpasta met pompoen uit de oven, in witte basissaus met room",
      "method": "human"
    }
  },
  "aliases": [],
  "category_id": "prepared_dishes"
}
