{
  "bls_code": "G730132",
  "display_names": {
    "fr": {
      "value": "Fève immature bouillie",
      "method": "machine"
    },
    "it": {
      "value": "Fava immatura bollita",
      "method": "machine"
    },
    "ja": {
      "value": "未熟そら豆（ゆで）",
      "method": "machine"
    },
    "es": {
      "value": "haba verde, cocida",
      "method": "human"
    },
    "nl": {
      "value": "onrijpe tuinboon, gekookt",
      "method": "human"
    }
  },
  "aliases": [
    {
      "language_code": "en",
      "value": "fava bean",
      "kind": "synonym",
      "method": "machine",
      "match_scope": "candidate_only",
      "review_status": "candidate_only"
    }
  ],
  "category_id": "legumes_soy"
}
