{
  "bls_code": "H650100",
  "display_names": {
    "fr": {
      "value": "Germes de haricot mungo crus",
      "method": "machine"
    },
    "it": {
      "value": "Germogli di fagiolo mungo crudi",
      "method": "machine"
    },
    "ja": {
      "value": "生の緑豆もやし",
      "method": "machine"
    },
    "es": {
      "value": "Brotes de judía mungo, crudos",
      "method": "human"
    },
    "nl": {
      "value": "mungboonscheuten, rauw",
      "method": "human"
    }
  },
  "aliases": [],
  "category_id": "legumes_soy"
}
