{
  "bls_code": "D655100",
  "display_names": {
    "fr": {
      "value": "Gâteau fin au miel et aux épices",
      "method": "machine"
    },
    "it": {
      "value": "Torta fine al miele e spezie",
      "method": "machine"
    },
    "ja": {
      "value": "上質なはちみつスパイスケーキ",
      "method": "machine"
    },
    "es": {
      "value": "Pastel fino de miel",
      "method": "human"
    },
    "nl": {
      "value": "Fijne honingkoek",
      "method": "human"
    }
  },
  "aliases": [],
  "category_id": "snacks_sweets"
}
