{
  "bls_code": "X5B1150",
  "display_names": {
    "fr": {
      "value": "Purée de légumes, pommes de terre et céréales, à la carotte et aux flocons d’avoine, sans sel, adaptée à la diversification alimentaire",
      "method": "machine"
    },
    "it": {
      "value": "Purea di verdure, patate e cereali, con carota e fiocchi d’avena, senza sale, adatta allo svezzamento",
      "method": "machine"
    },
    "ja": {
      "value": "ニンジンとオートミール入り野菜・じゃがいも・穀類ピューレ（無塩、離乳食向け）",
      "method": "machine"
    },
    "es": {
      "value": "Papilla de verduras, patata, zanahoria y copos de avena (sin sal, apta para alimentación complementaria)",
      "method": "human"
    },
    "nl": {
      "value": "Groente-aardappelpap met wortel en havervlokken (zonder zout, geschikt als babyvoeding)",
      "method": "human"
    }
  },
  "aliases": [],
  "category_id": "prepared_dishes"
}
