{
  "bls_code": "D650500",
  "display_names": {
    "fr": {
      "value": "Lebkuchen fins sur hosties",
      "method": "machine"
    },
    "it": {
      "value": "Lebkuchen fini su ostie",
      "method": "machine"
    },
    "ja": {
      "value": "薄焼きウエハース台のレープクーヘン",
      "method": "machine"
    },
    "es": {
      "value": "Pan de jengibre fino sobre oblea",
      "method": "human"
    },
    "nl": {
      "value": "Fijne peperkoek op ouwel",
      "method": "human"
    }
  },
  "aliases": [],
  "category_id": "snacks_sweets"
}
