{
  "bls_code": "Y131032",
  "display_names": {
    "fr": {
      "value": "Rosbif cuit au four, avec légumes rôtis",
      "method": "machine"
    },
    "it": {
      "value": "Roast beef al forno, con verdure arrostite",
      "method": "machine"
    },
    "ja": {
      "value": "ローストビーフ、オーブン焼き、ロースト野菜添え",
      "method": "machine"
    },
    "es": {
      "value": "rosbif asado al horno con verduras asadas",
      "method": "human"
    },
    "nl": {
      "value": "rosbief gebraden in de oven met geroosterde groenten",
      "method": "human"
    }
  },
  "aliases": [],
  "category_id": "meat_poultry"
}
