{
  "bls_code": "N720200",
  "display_names": {
    "fr": {
      "value": "Infusion de plantes avec du lait à 3,5 % de matières grasses",
      "method": "machine"
    },
    "it": {
      "value": "Infuso di erbe con latte al 3,5 % di grassi",
      "method": "machine"
    },
    "ja": {
      "value": "脂肪分3.5％の牛乳入りハーブティー",
      "method": "machine"
    },
    "es": {
      "value": "Infusión de hierbas con leche con 3,5 % de grasa",
      "method": "machine-reviewed"
    },
    "nl": {
      "value": "Kruidenthee met melk met 3,5% vet",
      "method": "machine-reviewed"
    }
  },
  "aliases": [],
  "category_id": "beverages"
}
